"SULFOTRANSFERASE_ACTIVITY (GO:0008146)";"https://www.gsea-msigdb.org/gsea/msigdb/cards/GOMF_SULFOTRANSFERASE_ACTIVITY.html";"Catalysis of the transfer of a sulfate group from 3'-phosphoadenosine 5'-phosphosulfate to the hydroxyl group of an acceptor, producing the sulfated derivative and 3'-phosphoadenosine 5'-phosphate. [EC:2.8.2.-]";53;-0,6130369;-0,9867304;0,4924623;1;1;1409;"tags=26%, list=4%, signal=27%"
"NEGATIVE_REGULATION_OF_TUMOR_NECROSIS_FACTOR_SUPERFAMILY_CYTOKINE_PRODUCTION (GO:1903556)";"https://www.gsea-msigdb.org/gsea/msigdb/cards/GOBP_NEGATIVE_REGULATION_OF_TUMOR_NECROSIS_FACTOR_SUPERFAMILY_CYTOKINE_PRODUCTION.html";"Any process that stops, prevents or reduces the frequency, rate or extent of tumor necrosis factor superfamily cytokine production. [GO_REF:0000058, GOC:TermGenie, PMID:24187568]";84;-0,5603384;-0,9858219;0,45320198;1;1;83;"tags=4%, list=0%, signal=4%"
"VERY_LONG_CHAIN_FATTY_ACID_METABOLIC_PROCESS (GO:0000038)";"https://www.gsea-msigdb.org/gsea/msigdb/cards/GOBP_VERY_LONG_CHAIN_FATTY_ACID_METABOLIC_PROCESS.html";"The chemical reactions and pathways involving a very long-chain fatty acid. A very long-chain fatty acid has an aliphatic tail containing more than 22 carbons. [GOC:hjd]";35;-0,6509427;-0,9856935;0,52680653;1;1;1762;"tags=17%, list=5%, signal=18%"
"TRANS_NETWORK_TRANSPORT_VESICLE_MEMBRANE (GO:0012510)";"https://www.gsea-msigdb.org/gsea/msigdb/cards/GOCC_TRANS_GOLGI_NETWORK_TRANSPORT_VESICLE_MEMBRANE.html";"The lipid bilayer surrounding a vesicle transporting substances between the trans-Golgi network and other parts of the cell. [GOC:ai]";21;-0,68881714;-0,9856848;0,5396419;1;1;51;"tags=5%, list=0%, signal=5%"
"REGULATION_OF_CENTROSOME_DUPLICATION (GO:0010824)";"https://www.gsea-msigdb.org/gsea/msigdb/cards/GOBP_REGULATION_OF_CENTROSOME_DUPLICATION.html";"Any process that modulates the frequency, rate or extent of centrosome duplication. Centrosome duplication is the replication of a centrosome, a structure comprised of a pair of centrioles and peri-centriolar material from which a microtubule spindle apparatus is organized. [GOC:dph, GOC:tb]";50;-0,6190737;-0,98528355;0,4872449;1;1;225;"tags=2%, list=1%, signal=2%"
"REGULATION_OF_EXTRACELLULAR_MATRIX_DISASSEMBLY (GO:0010715)";"https://www.gsea-msigdb.org/gsea/msigdb/cards/GOBP_REGULATION_OF_EXTRACELLULAR_MATRIX_DISASSEMBLY.html";"Any process that modulates the rate, frequency or extent of extracellular matrix disassembly. Extracellular matrix disassembly is a process that results in the breakdown of the extracellular matrix. [GOC:BHF, GOC:dph, GOC:tb]";26;-0,6683847;-0,98528;0,48370928;1;1;530;"tags=8%, list=1%, signal=8%"
"RESPONSE_TO_SALT_STRESS (GO:0009651)";"https://www.gsea-msigdb.org/gsea/msigdb/cards/GOBP_RESPONSE_TO_SALT_STRESS.html";"Any process that results in a change in state or activity of a cell or an organism (in terms of movement, secretion, enzyme production, gene expression, etc.) as a result of a stimulus indicating an increase or decrease in the concentration of salt (particularly but not exclusively sodium and chloride ions) in the environment. [GOC:jl]";22;-0,69774604;-0,9851955;0,5339806;1;1;2558;"tags=41%, list=7%, signal=44%"
"GAMMA_DELTA_T_CELL_ACTIVATION (GO:0046629)";"https://www.gsea-msigdb.org/gsea/msigdb/cards/GOBP_GAMMA_DELTA_T_CELL_ACTIVATION.html";"The change in morphology and behavior of a gamma-delta T cell resulting from exposure to a mitogen, cytokine, chemokine, cellular ligand, or an antigen for which it is specific. [GOC:add]";27;-0,68191993;-0,9848618;0,5256724;1;1;997;"tags=15%, list=3%, signal=15%"
"NEGATIVE_REGULATION_OF_LIPID_BIOSYNTHETIC_PROCESS (GO:0051055)";"https://www.gsea-msigdb.org/gsea/msigdb/cards/GOBP_NEGATIVE_REGULATION_OF_LIPID_BIOSYNTHETIC_PROCESS.html";"Any process that stops, prevents, or reduces the frequency, rate or extent of the chemical reactions and pathways resulting in the formation of lipids. [GOC:ai]";70;-0,59165484;-0,98480624;0,47252747;1;1;952;"tags=11%, list=3%, signal=12%"
"CILIUM_OR_FLAGELLUM_DEPENDENT_CELL_MOTILITY (GO:0001539)";"https://www.gsea-msigdb.org/gsea/msigdb/cards/GOBP_CILIUM_OR_FLAGELLUM_DEPENDENT_CELL_MOTILITY.html";"Cell motility due to movement of eukaryotic cilia or bacterial-type flagella or archaeal-type flagella. [GOC:cilia, GOC:hjd, GOC:krc]";223;-0,49959448;-0,9847049;0,46753246;1;1;1896;"tags=7%, list=5%, signal=7%"
"CELLULAR_RESPONSE_TO_LEPTIN_STIMULUS (GO:0044320)";"https://www.gsea-msigdb.org/gsea/msigdb/cards/GOBP_CELLULAR_RESPONSE_TO_LEPTIN_STIMULUS.html";"Any process that results in a change in state or activity of a cell (in terms of movement, secretion, enzyme production, gene expression, etc.) as a result of a leptin stimulus. Leptin is a hormone manufactured primarily in the adipocytes of white adipose tissue, and the level of circulating leptin is directly proportional to the total amount of fat in the body. It plays a key role in regulating energy intake and energy expenditure, including appetite and metabolism. [GOC:yaf]";17;-0,7085685;-0,9846223;0,5541872;1;1;258;"tags=12%, list=1%, signal=12%"
"CALCIUM_DEPENDENT_PHOSPHOLIPASE_A2_ACTIVITY (GO:0047498)";"https://www.gsea-msigdb.org/gsea/msigdb/cards/GOMF_CALCIUM_DEPENDENT_PHOSPHOLIPASE_A2_ACTIVITY.html";"Catalysis of the reaction: phosphatidylcholine + H2O = 1-acylglycerophosphocholine + a carboxylate. This reaction requires Ca2+. [PMID:34831185]";17;-0,71225727;-0,98384434;0,5485437;1;1;1073;"tags=18%, list=3%, signal=18%"
"NON_MOTILE_CILIUM (GO:0097730)";"https://www.gsea-msigdb.org/gsea/msigdb/cards/GOCC_NON_MOTILE_CILIUM.html";"A cilium which may have a variable array of axonemal microtubules but does not contain molecular motors. [GOC:cilia, GOC:dgh, GOC:kmv, PMID:17009929, PMID:20144998, PMID:22118931]";171;-0,5065824;-0,98380375;0,45697328;1;1;2666;"tags=18%, list=7%, signal=19%"
"LIPID_IMPORT_INTO_CELL (GO:0140354)";"https://www.gsea-msigdb.org/gsea/msigdb/cards/GOBP_LIPID_IMPORT_INTO_CELL.html";"The directed movement of a lipid from outside of a cell into a cell. This may occur via transport across the plasma membrane or via endocytosis. [GOC:pg]";22;-0,69502616;-0,9836748;0,5420792;1;1;1350;"tags=27%, list=4%, signal=28%"
"REGULATION_OF_CENTROSOME_CYCLE (GO:0046605)";"https://www.gsea-msigdb.org/gsea/msigdb/cards/GOBP_REGULATION_OF_CENTROSOME_CYCLE.html";"Any process that modulates the frequency, rate or extent of the centrosome cycle, the processes of centrosome duplication and separation. [GOC:ai]";59;-0,60175395;-0,98343164;0,48370928;1;1;225;"tags=2%, list=1%, signal=2%"
"MITOCHONDRIAL_PROTEIN_CONTAINING_COMPLEX (GO:0098798)";"https://www.gsea-msigdb.org/gsea/msigdb/cards/GOCC_MITOCHONDRIAL_PROTEIN_CONTAINING_COMPLEX.html";"A protein complex that is part of a mitochondrion. [GOC:dos]";177;-0,50183547;-0,98279154;0,45040214;1;1;4968;"tags=24%, list=14%, signal=27%"
"RENAL_SODIUM_ION_TRANSPORT (GO:0003096)";"https://www.gsea-msigdb.org/gsea/msigdb/cards/GOBP_RENAL_SODIUM_ION_TRANSPORT.html";"The directed movement of sodium ions (Na+) by the renal system. [GOC:mtg_cardio]";19;-0,7031145;-0,98238343;0,5511628;1;1;2076;"tags=32%, list=6%, signal=33%"
"CELLULAR_RESPONSE_TO_IONIZING_RADIATION (GO:0071479)";"https://www.gsea-msigdb.org/gsea/msigdb/cards/GOBP_CELLULAR_RESPONSE_TO_IONIZING_RADIATION.html";"Any process that results in a change in state or activity of a cell (in terms of movement, secretion, enzyme production, gene expression, etc.) as a result of a ionizing radiation stimulus. Ionizing radiation is radiation with sufficient energy to remove electrons from atoms and may arise from spontaneous decay of unstable isotopes, resulting in alpha and beta particles and gamma rays. Ionizing radiation also includes X-rays. [GOC:mah]";75;-0,57127464;-0,98191994;0,46173468;1;1;1499;"tags=12%, list=4%, signal=12%"
"RESPONSE_TO_UV_A (GO:0070141)";"https://www.gsea-msigdb.org/gsea/msigdb/cards/GOBP_RESPONSE_TO_UV_A.html";"Any process that results in a change in state or activity of a cell or an organism (in terms of movement, secretion, enzyme production, gene expression, etc.) as a result of a UV-A radiation stimulus. UV-A radiation (UV-A light) spans the wavelengths 315 to 400 nm. [GOC:BHF, GOC:mah]";15;-0,72421706;-0,9817583;0,56594723;1;1;1066;"tags=13%, list=3%, signal=14%"
"REGULATION_OF_NEURON_PROJECTION_REGENERATION (GO:0070570)";"https://www.gsea-msigdb.org/gsea/msigdb/cards/GOBP_REGULATION_OF_NEURON_PROJECTION_REGENERATION.html";"Any process that modulates the rate, frequency or extent of neuron projection regeneration, the regrowth of neuronal processes such as axons or dendrites following their loss or damage. [GOC:mah]";33;-0,6675094;-0,9816616;0,5089058;1;1;16;"tags=3%, list=0%, signal=3%"
"GLYCEROPHOSPHOLIPID_METABOLIC_PROCESS (GO:0006650)";"https://www.gsea-msigdb.org/gsea/msigdb/cards/GOBP_GLYCEROPHOSPHOLIPID_METABOLIC_PROCESS.html";"The chemical reactions and pathways involving glycerophospholipids, any derivative of glycerophosphate that contains at least one O-acyl, O-alkyl, or O-alkenyl group attached to the glycerol residue. [ISBN:0198506732]";300;-0,47939545;-0,9815206;0,48726115;1;1;1530;"tags=11%, list=4%, signal=11%"
"NADP_METABOLIC_PROCESS (GO:0006739)";"https://www.gsea-msigdb.org/gsea/msigdb/cards/GOBP_NADP_METABOLIC_PROCESS.html";"The chemical reactions and pathways involving nicotinamide adenine dinucleotide phosphate (NADP+), a coenzyme that interconverts with its reduced form, NADPH, in many redox and biosynthetic reactions. [GOC:mah]";41;-0,6329023;-0,98134077;0,49264705;1;1;1204;"tags=12%, list=3%, signal=13%"
"PRIMARY_ALCOHOL_METABOLIC_PROCESS (GO:0034308)";"https://www.gsea-msigdb.org/gsea/msigdb/cards/GOBP_PRIMARY_ALCOHOL_METABOLIC_PROCESS.html";"The chemical reactions and pathways involving primary alcohols. A primary alcohol is any alcohol in which a hydroxy group, -OH, is attached to a saturated carbon atom which has either three hydrogen atoms attached to it or only one other carbon atom and two hydrogen atoms attached to it. [GOC:mah]";103;-0,5407394;-0,98097944;0,4701087;1;1;1153;"tags=17%, list=3%, signal=17%"
"POSITIVE_REGULATION_OF_TRANSMEMBRANE_TRANSPORT (GO:0034764)";"https://www.gsea-msigdb.org/gsea/msigdb/cards/GOBP_POSITIVE_REGULATION_OF_TRANSMEMBRANE_TRANSPORT.html";"Any process that activates or increases the frequency, rate or extent of the directed movement of a solute from one side of a membrane to the other. [GOC:mah]";191;-0,5021128;-0,9803658;0,48795182;1;1;1283;"tags=11%, list=4%, signal=11%"
"OXIDOREDUCTASE_ACTIVITY_ACTING_ON_THE_CH_NH2_GROUP_OF_DONORS_OXYGEN_AS_ACCEPTOR (GO:0016641)";"https://www.gsea-msigdb.org/gsea/msigdb/cards/GOMF_OXIDOREDUCTASE_ACTIVITY_ACTING_ON_THE_CH_NH2_GROUP_OF_DONORS_OXYGEN_AS_ACCEPTOR.html";"Catalysis of an oxidation-reduction (redox) reaction in which a CH-NH2 group acts as a hydrogen or electron donor and reduces an oxygen molecule. [GOC:ai]";16;-0,7146568;-0,98024076;0,562341;1;1;1116;"tags=31%, list=3%, signal=32%"
"PROTEIN_HORMONE_RECEPTOR_ACTIVITY (GO:0016500)";"https://www.gsea-msigdb.org/gsea/msigdb/cards/GOMF_PROTEIN_HORMONE_RECEPTOR_ACTIVITY.html";"Combining with a protein hormone to initiate a change in cell activity. [GOC:mah]";21;-0,6878621;-0,98016196;0,5409836;1;1;2336;"tags=24%, list=6%, signal=25%"
"POSITIVE_REGULATION_OF_PHOSPHATIDYLINOSITOL_3_KINASE_PROTEIN_KINASE_B_SIGNAL_TRANSDUCTION (GO:0051897)";"https://www.gsea-msigdb.org/gsea/msigdb/cards/GOBP_POSITIVE_REGULATION_OF_PHOSPHATIDYLINOSITOL_3_KINASE_PROTEIN_KINASE_B_SIGNAL_TRANSDUCTION.html";"Any process that activates or increases the frequency, rate or extent of phosphatidylinositol 3-kinase/protein kinase B signal transduction. [GOC:ai]";208;-0,49884006;-0,9797465;0,47091413;1;1;1179;"tags=9%, list=3%, signal=9%"
"HEMOGLOBIN_METABOLIC_PROCESS (GO:0020027)";"https://www.gsea-msigdb.org/gsea/msigdb/cards/GOBP_HEMOGLOBIN_METABOLIC_PROCESS.html";"The chemical reactions and pathways involving hemoglobin, including its uptake and utilization. [GOC:go_curators, GOC:jl]";19;-0,70772296;-0,979322;0,56148493;1;1;426;"tags=16%, list=1%, signal=16%"
"PURINE_CONTAINING_COMPOUND_TRANSMEMBRANE_TRANSPORT (GO:0072530)";"https://www.gsea-msigdb.org/gsea/msigdb/cards/GOBP_PURINE_CONTAINING_COMPOUND_TRANSMEMBRANE_TRANSPORT.html";"The process in which a purine-containing compound is transported across a membrane. A purine-containing compound is any compound that contains purine or a formal derivative thereof. [GOC:mah]";40;-0,627458;-0,9790676;0,5141388;1;1;1311;"tags=10%, list=4%, signal=10%"
"SULFUR_COMPOUND_TRANSPORT (GO:0072348)";"https://www.gsea-msigdb.org/gsea/msigdb/cards/GOBP_SULFUR_COMPOUND_TRANSPORT.html";"The directed movement of compounds that contain sulfur, out of or within a cell, or between cells, by means of some agent such as a transporter or pore. [GOC:mah]";66;-0,5815459;-0,97867584;0,48711342;1;1;1634;"tags=23%, list=4%, signal=24%"
"INTRACELLULAR_GLUCOSE_HOMEOSTASIS (GO:0001678)";"https://www.gsea-msigdb.org/gsea/msigdb/cards/GOBP_INTRACELLULAR_GLUCOSE_HOMEOSTASIS.html";"A homeostatic process involved in the maintenance of a steady state level of glucose within a cell. [GOC:dph, GOC:go_curators, GOC:tb]";169;-0,5064136;-0,97838116;0,49714285;1;1;1353;"tags=9%, list=4%, signal=10%"
"SODIUM_ION_TRANSPORT (GO:0006814)";"https://www.gsea-msigdb.org/gsea/msigdb/cards/GOBP_SODIUM_ION_TRANSPORT.html";"The directed movement of sodium ions (Na+) into, out of or within a cell, or between cells, by means of some agent such as a transporter or pore. [GOC:ai]";251;-0,4884957;-0,97823805;0,46474358;1;1;1156;"tags=12%, list=3%, signal=13%"
"TRANSFORMING_GROWTH_FACTOR_BETA_BINDING (GO:0050431)";"https://www.gsea-msigdb.org/gsea/msigdb/cards/GOMF_TRANSFORMING_GROWTH_FACTOR_BETA_BINDING.html";"Binding to TGF-beta, transforming growth factor beta, a multifunctional peptide that controls proliferation, differentiation and other functions in many cell types. [ISBN:0198506732]";24;-0,6751044;-0,9780074;0,52757794;1;1;1521;"tags=17%, list=4%, signal=17%"
"AMINO_ACID_BINDING (GO:0016597)";"https://www.gsea-msigdb.org/gsea/msigdb/cards/GOMF_AMINO_ACID_BINDING.html";"Binding to an amino acid, organic acids containing one or more amino substituents. [GOC:ai]";49;-0,6071737;-0,97684884;0,4920635;1;1;1912;"tags=27%, list=5%, signal=28%"
"POSITIVE_REGULATION_OF_ENDOTHELIAL_CELL_DIFFERENTIATION (GO:0045603)";"https://www.gsea-msigdb.org/gsea/msigdb/cards/GOBP_POSITIVE_REGULATION_OF_ENDOTHELIAL_CELL_DIFFERENTIATION.html";"Any process that activates or increases the frequency, rate or extent of endothelial cell differentiation. [GOC:go_curators]";19;-0,69491255;-0,97665894;0,54653937;1;1;1577;"tags=11%, list=4%, signal=11%"
"MITOCHONDRIAL_MEMBRANE_ORGANIZATION (GO:0007006)";"https://www.gsea-msigdb.org/gsea/msigdb/cards/GOBP_MITOCHONDRIAL_MEMBRANE_ORGANIZATION.html";"A process that is carried out at the cellular level which results in the assembly, arrangement of constituent parts, or disassembly of a mitochondrial membrane, either of the lipid bilayer surrounding a mitochondrion. [GOC:ai, GOC:dph, GOC:jl, GOC:mah]";119;-0,52971154;-0,9766004;0,48097825;1;1;2560;"tags=12%, list=7%, signal=13%"
"RESPONSE_TO_MACROPHAGE_COLONY_STIMULATING_FACTOR (GO:0036005)";"https://www.gsea-msigdb.org/gsea/msigdb/cards/GOBP_RESPONSE_TO_MACROPHAGE_COLONY_STIMULATING_FACTOR.html";"Any process that results in a change in state or activity of a cell or an organism (in terms of movement, secretion, enzyme production, gene expression, etc.) as a result of a macrophage colony-stimulating factor stimulus. [GOC:yaf, PMID:14687666]";17;-0,7127328;-0,97639275;0,5949657;1;1;727;"tags=12%, list=2%, signal=12%"
"POSITIVE_REGULATION_OF_ACTIN_FILAMENT_BUNDLE_ASSEMBLY (GO:0032233)";"https://www.gsea-msigdb.org/gsea/msigdb/cards/GOBP_POSITIVE_REGULATION_OF_ACTIN_FILAMENT_BUNDLE_ASSEMBLY.html";"Any process that activates or increases the frequency, rate or extent of the assembly of actin filament bundles. [GOC:mah]";62;-0,5916648;-0,97636414;0,4832905;1;1;676;"tags=11%, list=2%, signal=11%"
"REGULATION_OF_HORMONE_SECRETION (GO:0046883)";"https://www.gsea-msigdb.org/gsea/msigdb/cards/GOBP_REGULATION_OF_HORMONE_SECRETION.html";"Any process that modulates the frequency, rate or extent of the regulated release of a hormone from a cell. [GOC:ai]";273;-0,48574844;-0,9760969;0,4668588;1;1;479;"tags=6%, list=1%, signal=6%"
"FILOPODIUM (GO:0030175)";"https://www.gsea-msigdb.org/gsea/msigdb/cards/GOCC_FILOPODIUM.html";"Thin, stiff, actin-based protrusion extended by the leading edge of a motile cell such as a crawling fibroblast or amoeba, or an axonal or dendritic growth cone, or a dendritic shaft. [GOC:mah, GOC:pr, ISBN:0815316194]";105;-0,5376351;-0,9756271;0,486631;1;1;1907;"tags=18%, list=5%, signal=19%"
"RESPONSE_TO_IONIZING_RADIATION (GO:0010212)";"https://www.gsea-msigdb.org/gsea/msigdb/cards/GOBP_RESPONSE_TO_IONIZING_RADIATION.html";"Any process that results in a change in state or activity of a cell or an organism (in terms of movement, secretion, enzyme production, gene expression, etc.) as a result of a ionizing radiation stimulus. Ionizing radiation is radiation with sufficient energy to remove electrons from atoms and may arise from spontaneous decay of unstable isotopes, resulting in alpha and beta particles and gamma rays. Ionizing radiation also includes X-rays. [PMID:12509526]";146;-0,5104499;-0,97540087;0,48128343;1;1;1927;"tags=10%, list=5%, signal=10%"
"POSITIVE_REGULATION_OF_MIRNA_METABOLIC_PROCESS (GO:2000630)";"https://www.gsea-msigdb.org/gsea/msigdb/cards/GOBP_POSITIVE_REGULATION_OF_MIRNA_METABOLIC_PROCESS.html";"Any process that activates or increases the frequency, rate or extent of miRNA metabolic process. [GOC:dph]";65;-0,57543075;-0,97517574;0,5052083;1;1;840;"tags=9%, list=2%, signal=9%"
"TIGHT_JUNCTION (GO:0070160)";"https://www.gsea-msigdb.org/gsea/msigdb/cards/GOCC_TIGHT_JUNCTION.html";"A cell-cell junction that seals cells together in an epithelium in a way that prevents even small molecules from leaking from one side of the sheet to the other. [ISBN:0815332181]";136;-0,53012705;-0,9749881;0,47969544;1;1;1858;"tags=20%, list=5%, signal=21%"
"QUATERNARY_AMMONIUM_GROUP_TRANSPORT (GO:0015697)";"https://www.gsea-msigdb.org/gsea/msigdb/cards/GOBP_QUATERNARY_AMMONIUM_GROUP_TRANSPORT.html";"The directed movement into, out of or within a cell, or between cells, by means of some agent such as a transporter or pore of quaternary ammonium compounds, any compound that can be regarded as derived from ammonium hydroxide or an ammonium salt by replacement of all four hydrogen atoms of the NH4+ ion by organic groups. [GOC:ai, ISBN:0198506732]";18;-0,71366805;-0,9748245;0,5625;1;1;1165;"tags=22%, list=3%, signal=23%"
"RETROMER_COMPLEX (GO:0030904)";"https://www.gsea-msigdb.org/gsea/msigdb/cards/GOCC_RETROMER_COMPLEX.html";"A conserved hetero-pentameric membrane-associated complex involved in retrograde transport from endosomes to the Golgi apparatus. The budding yeast retromer comprises Vps35p, Vps29p, Vps26p, Vps5p, and Vps17p. The mammalian complex shows slight variation in composition compared to yeast, and comprises SNX1 or SNX2, SNX5 or SNX6, VPS26A or VPS26B, VPS29, and VPS35. [GOC:bf, PMID:26220253, PMID:27385586, PMID:9700157]";21;-0,68672186;-0,9744147;0,543943;1;1;1312;"tags=5%, list=4%, signal=5%"
"MYOFILAMENT (GO:0036379)";"https://www.gsea-msigdb.org/gsea/msigdb/cards/GOCC_MYOFILAMENT.html";"Any of the smallest contractile units of a myofibril (striated muscle fiber). [Wikipedia:Myofilament]";26;-0,6816461;-0,9743675;0,54846936;1;1;1187;"tags=27%, list=3%, signal=28%"
"ACTIN_BASED_CELL_PROJECTION (GO:0098858)";"https://www.gsea-msigdb.org/gsea/msigdb/cards/GOCC_ACTIN_BASED_CELL_PROJECTION.html";"A cell projection supported by an assembly of actin filaments, and which lacks microtubules. [PMID:15661519]";231;-0,49122298;-0,97346145;0,49275362;1;1;1628;"tags=16%, list=4%, signal=17%"
"RENAL_WATER_HOMEOSTASIS (GO:0003091)";"https://www.gsea-msigdb.org/gsea/msigdb/cards/GOBP_RENAL_WATER_HOMEOSTASIS.html";"Renal process involved in the maintenance of an internal steady state of water in the body. [GOC:mtg_cardio]";24;-0,67220634;-0,9733699;0,5343681;1;1;733;"tags=21%, list=2%, signal=21%"
"POLYUBIQUITIN_MODIFICATION_DEPENDENT_PROTEIN_BINDING (GO:0031593)";"https://www.gsea-msigdb.org/gsea/msigdb/cards/GOMF_POLYUBIQUITIN_MODIFICATION_DEPENDENT_PROTEIN_BINDING.html";"Binding to a protein upon poly-ubiquitination of the target protein. [GOC:pg]";59;-0,59475636;-0,97290033;0,5242967;1;1;5066;"tags=31%, list=14%, signal=35%"
"DENDRITIC_SPINE_MAINTENANCE (GO:0097062)";"https://www.gsea-msigdb.org/gsea/msigdb/cards/GOBP_DENDRITIC_SPINE_MAINTENANCE.html";"The organization process that preserves a dendritic spine in a stable functional or structural state. A dendritic spine is a specialized protrusion from a neuronal dendrite and is involved in synaptic transmission. [GOC:BHF, PMID:20410104]";24;-0,67574453;-0,9726633;0,53652394;1;1;1175;"tags=17%, list=3%, signal=17%"
"OXIDOREDUCTASE_ACTIVITY_ACTING_ON_A_SULFUR_GROUP_OF_DONORS (GO:0016667)";"https://www.gsea-msigdb.org/gsea/msigdb/cards/GOMF_OXIDOREDUCTASE_ACTIVITY_ACTING_ON_A_SULFUR_GROUP_OF_DONORS.html";"Catalysis of an oxidation-reduction (redox) reaction in which a sulfur-containing group acts as a hydrogen or electron donor and reduces a hydrogen or electron acceptor. [EC:1.8.-.-, GOC:ai]";56;-0,5928432;-0,97242963;0,5063291;1;1;3891;"tags=30%, list=11%, signal=34%"
"NEGATIVE_REGULATION_OF_APOPTOTIC_SIGNALING_PATHWAY (GO:2001234)";"https://www.gsea-msigdb.org/gsea/msigdb/cards/GOBP_NEGATIVE_REGULATION_OF_APOPTOTIC_SIGNALING_PATHWAY.html";"Any process that stops, prevents or reduces the frequency, rate or extent of apoptotic signaling pathway. [GOC:mtg_apoptosis]";244;-0,4834248;-0,97217727;0,4893617;1;1;1554;"tags=7%, list=4%, signal=8%"
"REGULATION_OF_PHOSPHOLIPID_METABOLIC_PROCESS (GO:1903725)";"https://www.gsea-msigdb.org/gsea/msigdb/cards/GOBP_REGULATION_OF_PHOSPHOLIPID_METABOLIC_PROCESS.html";"Any process that modulates the frequency, rate or extent of phospholipid metabolic process. [GO_REF:0000058, GOC:TermGenie, PMID:10657240]";37;-0,63345957;-0,9720294;0,5244755;1;1;1408;"tags=16%, list=4%, signal=17%"
"METAL_CATION_PROTON_ANTIPORTER_ACTIVITY (GO:0051139)";"https://www.gsea-msigdb.org/gsea/msigdb/cards/GOMF_METAL_CATION_PROTON_ANTIPORTER_ACTIVITY.html";"Enables the transfer of a solute or solutes from one side of a membrane to the other according to the reaction: metal ion(in) + H+(out) = metal ion(out) + H+(in). [GOC:mlg]";27;-0,6670714;-0,9717268;0,54137117;1;1;211;"tags=7%, list=1%, signal=7%"
"DENDRITIC_CELL_MIGRATION (GO:0036336)";"https://www.gsea-msigdb.org/gsea/msigdb/cards/GOBP_DENDRITIC_CELL_MIGRATION.html";"The movement of a dendritic cell within or between different tissues and organs of the body. [CL:0000451, GOC:nhn, PMID:19339990]";33;-0,6401993;-0,97064793;0,5320197;1;1;903;"tags=9%, list=2%, signal=9%"
"MECHANOSENSITIVE_MONOATOMIC_ION_CHANNEL_ACTIVITY (GO:0008381)";"https://www.gsea-msigdb.org/gsea/msigdb/cards/GOMF_MECHANOSENSITIVE_MONOATOMIC_ION_CHANNEL_ACTIVITY.html";"Enables the transmembrane transfer of an monoatomic ion by a channel that opens in response to a mechanical stress. [GOC:mtg_transport, ISBN:0815340729]";20;-0,6812337;-0,9701519;0,5464191;1;1;1542;"tags=25%, list=4%, signal=26%"
"POSITIVE_REGULATION_OF_FATTY_ACID_BIOSYNTHETIC_PROCESS (GO:0045723)";"https://www.gsea-msigdb.org/gsea/msigdb/cards/GOBP_POSITIVE_REGULATION_OF_FATTY_ACID_BIOSYNTHETIC_PROCESS.html";"Any process that activates or increases the frequency, rate or extent of the chemical reactions and pathways resulting in the formation of fatty acids. [GOC:go_curators]";24;-0,6763341;-0,96856225;0,5427136;1;1;1073;"tags=21%, list=3%, signal=21%"
"SISTER_CHROMATID_COHESION (GO:0007062)";"https://www.gsea-msigdb.org/gsea/msigdb/cards/GOBP_SISTER_CHROMATID_COHESION.html";"The cell cycle process in which the sister chromatids of a replicated chromosome become tethered to each other. [GOC:jh, GOC:mah, ISBN:0815316194]";61;-0,58253247;-0,96819305;0,53652394;1;1;300;"tags=2%, list=1%, signal=2%"
"NEGATIVE_REGULATION_OF_EPITHELIAL_CELL_PROLIFERATION (GO:0050680)";"https://www.gsea-msigdb.org/gsea/msigdb/cards/GOBP_NEGATIVE_REGULATION_OF_EPITHELIAL_CELL_PROLIFERATION.html";"Any process that stops, prevents or reduces the rate or extent of epithelial cell proliferation. [GOC:ai]";177;-0,4992178;-0,9675664;0,5;1;1;1117;"tags=7%, list=3%, signal=8%"
"ATPASE_BINDING (GO:0051117)";"https://www.gsea-msigdb.org/gsea/msigdb/cards/GOMF_ATPASE_BINDING.html";"Binding to an ATPase, any enzyme that catalyzes the hydrolysis of ATP. [GOC:ai]";89;-0,5582948;-0,9667422;0,5054645;1;1;2318;"tags=13%, list=6%, signal=14%"
"NEUROBLAST_DIVISION (GO:0055057)";"https://www.gsea-msigdb.org/gsea/msigdb/cards/GOBP_NEUROBLAST_DIVISION.html";"The process resulting in the physical partitioning and separation of a neuroblast into daughter cells. A neuroblast is any cell that will divide and give rise to a neuron. [PMID:11163136, PMID:11250167]";15;-0,7155707;-0,966507;0,601023;1;1;1299;"tags=20%, list=4%, signal=21%"
"RESPONSE_TO_VITAMIN (GO:0033273)";"https://www.gsea-msigdb.org/gsea/msigdb/cards/GOBP_RESPONSE_TO_VITAMIN.html";"Any process that results in a change in state or activity of a cell or an organism (in terms of movement, secretion, enzyme production, gene expression, etc.) as a result of a vitamin stimulus. [GOC:sl]";89;-0,5499696;-0,9655324;0,5101523;1;1;998;"tags=16%, list=3%, signal=16%"
