"AMINO_ACID_BETAINE_METABOLIC_PROCESS (GO:0006577)";"https://www.gsea-msigdb.org/gsea/msigdb/cards/GOBP_AMINO_ACID_BETAINE_METABOLIC_PROCESS.html";"The chemical reactions and pathways involving any betaine, the N-trimethyl derivative of an amino acid. [GOC:mah, ISBN:0198506732]";19;-0,5973718;-0,8286108;0,72431076;1;1;691;"tags=26%, list=2%, signal=27%"
"TRANSFERASE_COMPLEX_TRANSFERRING_PHOSPHORUS_CONTAINING_GROUPS (GO:0061695)";"https://www.gsea-msigdb.org/gsea/msigdb/cards/GOCC_TRANSFERASE_COMPLEX_TRANSFERRING_PHOSPHORUS_CONTAINING_GROUPS.html";"A transferase complex capable of catalysis of the transfer of a phosphorus-containing group from one compound (donor) to another (acceptor). [GOC:bhm, GOC:dph]";301;-0,40748733;-0,8275827;0,9825073;1;1;2574;"tags=8%, list=7%, signal=9%"
"POSITIVE_REGULATION_OF_GLUCONEOGENESIS (GO:0045722)";"https://www.gsea-msigdb.org/gsea/msigdb/cards/GOBP_POSITIVE_REGULATION_OF_GLUCONEOGENESIS.html";"Any process that activates or increases the frequency, rate or extent of gluconeogenesis. [GOC:go_curators]";23;-0,5834996;-0,8270703;0,7384259;1;1;630;"tags=9%, list=2%, signal=9%"
"HOST_MEDIATED_SUPPRESSION_OF_SYMBIONT_INVASION (GO:0046597)";"https://www.gsea-msigdb.org/gsea/msigdb/cards/GOBP_HOST_MEDIATED_SUPPRESSION_OF_SYMBIONT_INVASION.html";"A process in which a host inhibits or disrupts the entry of a symbiont into a host cell. [PMID:23544079]";24;-0,5779522;-0,82683915;0,7375;1;1;1045;"tags=8%, list=3%, signal=9%"
"CENTROSOME_DUPLICATION (GO:0051298)";"https://www.gsea-msigdb.org/gsea/msigdb/cards/GOBP_CENTROSOME_DUPLICATION.html";"The replication of a centrosome, a structure comprised of a pair of centrioles and peri-centriolar material from which a microtubule spindle apparatus is organized. [GOC:ai]";81;-0,4751647;-0,82679075;0,77453583;1;1;225;"tags=1%, list=1%, signal=1%"
"STEROL_BINDING (GO:0032934)";"https://www.gsea-msigdb.org/gsea/msigdb/cards/GOMF_STEROL_BINDING.html";"Binding to a sterol, a steroid containing a hydroxy group in the 3 position, closely related to cholestan-3-ol. [GOC:mah]";69;-0,47890505;-0,8266209;0,78092784;1;1;1173;"tags=17%, list=3%, signal=18%"
"AEROBIC_RESPIRATION (GO:0009060)";"https://www.gsea-msigdb.org/gsea/msigdb/cards/GOBP_AEROBIC_RESPIRATION.html";"The enzymatic release of energy from inorganic and organic compounds (especially carbohydrates and fats) which requires oxygen as the terminal electron acceptor. [GOC:das, GOC:jl, ISBN:0140513590]";194;-0,42651692;-0,82647765;0,8981481;1;1;2732;"tags=12%, list=8%, signal=13%"
"DNA_TEMPLATED_TRANSCRIPTION_ELONGATION (GO:0006354)";"https://www.gsea-msigdb.org/gsea/msigdb/cards/GOBP_DNA_TEMPLATED_TRANSCRIPTION_ELONGATION.html";"The extension of an RNA molecule after transcription initiation and promoter clearance at a DNA-dependent RNA polymerase promoter by the addition of ribonucleotides catalyzed by an RNA polymerase. [GOC:mah, GOC:txnOH, PMID:15020047, PMID:18280161]";137;-0,4442776;-0,8261247;0,8476454;1;1;5588;"tags=31%, list=15%, signal=36%"
"MHC_CLASS_II_PROTEIN_COMPLEX_BINDING (GO:0023026)";"https://www.gsea-msigdb.org/gsea/msigdb/cards/GOMF_MHC_CLASS_II_PROTEIN_COMPLEX_BINDING.html";"Binding to a class II major histocompatibility complex. [GOC:mtg_signal, GOC:vw]";25;-0,56991845;-0,8260854;0,715;1;1;579;"tags=8%, list=2%, signal=8%"
"POSITIVE_REGULATION_OF_CANONICAL_WNT_SIGNALING_PATHWAY (GO:0090263)";"https://www.gsea-msigdb.org/gsea/msigdb/cards/GOBP_POSITIVE_REGULATION_OF_CANONICAL_WNT_SIGNALING_PATHWAY.html";"Any process that increases the rate, frequency, or extent of the Wnt signaling pathway through beta-catenin, the series of molecular signals initiated by binding of a Wnt protein to a frizzled family receptor on the surface of the target cell, followed by propagation of the signal via beta-catenin, and ending with a change in transcription of target genes. [GOC:tb]";116;-0,4501673;-0,82580596;0,8088643;1;1;1771;"tags=14%, list=5%, signal=14%"
"MIDBRAIN_DEVELOPMENT (GO:0030901)";"https://www.gsea-msigdb.org/gsea/msigdb/cards/GOBP_MIDBRAIN_DEVELOPMENT.html";"The process whose specific outcome is the progression of the midbrain over time, from its formation to the mature structure. The midbrain is the middle division of the three primary divisions of the developing chordate brain or the corresponding part of the adult brain (in vertebrates, includes a ventral part containing the cerebral peduncles and a dorsal tectum containing the corpora quadrigemina and that surrounds the aqueduct of Sylvius connecting the third and fourth ventricles). [PMID:4975589, PMID:4992177]";93;-0,4652747;-0,8256859;0,79112273;1;1;866;"tags=6%, list=2%, signal=7%"
"INTERLEUKIN_2_PRODUCTION (GO:0032623)";"https://www.gsea-msigdb.org/gsea/msigdb/cards/GOBP_INTERLEUKIN_2_PRODUCTION.html";"The appearance of interleukin-2 due to biosynthesis or secretion following a cellular stimulus, resulting in an increase in its intracellular or extracellular levels. [GOC:mah]";67;-0,5047692;-0,82560986;0,75979114;1;1;1361;"tags=12%, list=4%, signal=12%"
"MITOCHONDRIAL_ELECTRON_TRANSPORT_CYTOCHROME_C_TO_OXYGEN (GO:0006123)";"https://www.gsea-msigdb.org/gsea/msigdb/cards/GOBP_MITOCHONDRIAL_ELECTRON_TRANSPORT_CYTOCHROME_C_TO_OXYGEN.html";"The transfer of electrons from cytochrome c to oxygen that occurs during oxidative phosphorylation, mediated by the multisubunit enzyme known as complex IV. [ISBN:0716731363]";22;-0,5722766;-0,825193;0,75;1;1;3327;"tags=23%, list=9%, signal=25%"
"TRANSITION_METAL_ION_TRANSMEMBRANE_TRANSPORTER_ACTIVITY (GO:0046915)";"https://www.gsea-msigdb.org/gsea/msigdb/cards/GOMF_TRANSITION_METAL_ION_TRANSMEMBRANE_TRANSPORTER_ACTIVITY.html";"Enables the transfer of transition metal ions from one side of a membrane to the other. A transition metal is an element whose atom has an incomplete d-subshell of extranuclear electrons, or which gives rise to a cation or cations with an incomplete d-subshell. Transition metals often have more than one valency state. Biologically relevant transition metals include vanadium, manganese, iron, copper, cobalt, nickel, molybdenum and silver. [ISBN:0198506732]";45;-0,5193515;-0,8249711;0,7351485;1;1;1475;"tags=18%, list=4%, signal=19%"
"CERAMIDE_TRANSPORT (GO:0035627)";"https://www.gsea-msigdb.org/gsea/msigdb/cards/GOBP_CERAMIDE_TRANSPORT.html";"The directed movement of ceramides into, out of or within a cell, or between cells, by means of some agent such as a transporter or pore. Ceramides are a class of lipid composed of sphingosine linked to a fatty acid. [GOC:bf, GOC:sart]";18;-0,5892124;-0,8249017;0,7585366;1;1;1161;"tags=22%, list=3%, signal=23%"
"POSITIVE_REGULATION_OF_FATTY_ACID_METABOLIC_PROCESS (GO:0045923)";"https://www.gsea-msigdb.org/gsea/msigdb/cards/GOBP_POSITIVE_REGULATION_OF_FATTY_ACID_METABOLIC_PROCESS.html";"Any process that activates or increases the frequency, rate or extent of the chemical reactions and pathways involving fatty acids. [GOC:go_curators]";40;-0,52637166;-0,82397133;0,70528966;1;1;1073;"tags=13%, list=3%, signal=13%"
"M_BAND (GO:0031430)";"https://www.gsea-msigdb.org/gsea/msigdb/cards/GOCC_M_BAND.html";"The midline of aligned thick filaments in a sarcomere; location of specific proteins that link thick filaments. Depending on muscle type the M band consists of different numbers of M lines. [GOC:mtg_muscle, ISBN:0198506732, ISBN:0815316194]";29;-0,57624894;-0,8238618;0,74311924;1;1;1727;"tags=14%, list=5%, signal=14%"
"POSITIVE_REGULATION_OF_NITRIC_OXIDE_METABOLIC_PROCESS (GO:1904407)";"https://www.gsea-msigdb.org/gsea/msigdb/cards/GOBP_POSITIVE_REGULATION_OF_NITRIC_OXIDE_METABOLIC_PROCESS.html";"Any process that activates or increases the frequency, rate or extent of nitric oxide metabolic process. [GO_REF:0000058, GOC:TermGenie, PMID:11991626]";44;-0,52017236;-0,82374924;0,75443035;1;1;482;"tags=7%, list=1%, signal=7%"
"T_CELL_MEDIATED_IMMUNITY (GO:0002456)";"https://www.gsea-msigdb.org/gsea/msigdb/cards/GOBP_T_CELL_MEDIATED_IMMUNITY.html";"Any process involved in the carrying out of an immune response by a T cell. [GO_REF:0000022, GOC:add, ISBN:0781735149]";138;-0,4405354;-0,8236144;0,8551532;1;1;1329;"tags=12%, list=4%, signal=12%"
"REGULATION_OF_SODIUM_ION_TRANSMEMBRANE_TRANSPORT (GO:1902305)";"https://www.gsea-msigdb.org/gsea/msigdb/cards/GOBP_REGULATION_OF_SODIUM_ION_TRANSMEMBRANE_TRANSPORT.html";"Any process that modulates the frequency, rate or extent of sodium ion transmembrane transport. [GOC:BHF, GOC:mtg_cardiac_conduct_nov11, GOC:rl, GOC:TermGenie, PMID:18591664]";43;-0,5190289;-0,8232808;0,73740053;1;1;1095;"tags=12%, list=3%, signal=12%"
"REGULATION_OF_EPITHELIAL_CELL_MIGRATION (GO:0010632)";"https://www.gsea-msigdb.org/gsea/msigdb/cards/GOBP_REGULATION_OF_EPITHELIAL_CELL_MIGRATION.html";"Any process that modulates the frequency, rate or extent of epithelial cell migration. [GOC:BHF, GOC:dph, GOC:tb]";72;-0,4851003;-0,8228676;0,7774799;1;1;2714;"tags=21%, list=7%, signal=22%"
"INTEGRIN_ACTIVATION (GO:0033622)";"https://www.gsea-msigdb.org/gsea/msigdb/cards/GOBP_INTEGRIN_ACTIVATION.html";"The aggregation, arrangement and bonding together of an integrin, a heterodimeric adhesion receptor formed by the non-covalent association of particular alpha and beta subunits, that lead to the increased affinity of the integrin for its extracellular ligands. [GOC:add, PMID:12213832, PMID:14754902]";27;-0,55669045;-0,8227;0,7078385;1;1;1074;"tags=15%, list=3%, signal=15%"
"NEPHRON_EPITHELIUM_DEVELOPMENT (GO:0072009)";"https://www.gsea-msigdb.org/gsea/msigdb/cards/GOBP_NEPHRON_EPITHELIUM_DEVELOPMENT.html";"The process whose specific outcome is the progression of the nephron epithelium over time, from its formation to the mature structure. An epithelium is a tissue that covers the internal or external surfaces of an anatomical structure. The nephron epithelium is a tissue that covers the surface of a nephron. [GOC:mtg_kidney_jan10]";122;-0,4431447;-0,8223581;0,8505435;1;1;1198;"tags=11%, list=3%, signal=11%"
"CELL_JUNCTION_DISASSEMBLY (GO:0150146)";"https://www.gsea-msigdb.org/gsea/msigdb/cards/GOBP_CELL_JUNCTION_DISASSEMBLY.html";"The disaggregation of a cell junction into its constituent components. [GOC:aruk, PMID:25490267]";33;-0,54764813;-0,8222725;0,7128954;1;1;653;"tags=9%, list=2%, signal=9%"
"NONRIBOSOMAL_PEPTIDE_BIOSYNTHETIC_PROCESS (GO:0019184)";"https://www.gsea-msigdb.org/gsea/msigdb/cards/GOBP_NONRIBOSOMAL_PEPTIDE_BIOSYNTHETIC_PROCESS.html";"The biosynthetic process in which peptide bond formation occurs in the absence of the translational machinery. Examples include the synthesis of antibiotic peptides, and glutathione. [ISBN:0198506732]";18;-0,58848166;-0,82190275;0,7410072;1;1;580;"tags=22%, list=2%, signal=23%"
"CHOLESTEROL_BINDING (GO:0015485)";"https://www.gsea-msigdb.org/gsea/msigdb/cards/GOMF_CHOLESTEROL_BINDING.html";"Binding to cholesterol (cholest-5-en-3-beta-ol); the principal sterol of vertebrates and the precursor of many steroids, including bile acids and steroid hormones. [GOC:jl, ISBN:0198506732]";55;-0,4987785;-0,8218684;0,74520546;1;1;1342;"tags=22%, list=4%, signal=23%"
"NATURAL_KILLER_CELL_DIFFERENTIATION (GO:0001779)";"https://www.gsea-msigdb.org/gsea/msigdb/cards/GOBP_NATURAL_KILLER_CELL_DIFFERENTIATION.html";"The process in which a relatively unspecialized cell acquires the specialized features of a natural killer cell. [GOC:add, ISBN:0781735149]";27;-0,5600865;-0,8215373;0,72813237;1;1;2285;"tags=26%, list=6%, signal=28%"
"INTEGRATED_STRESS_RESPONSE_SIGNALING (GO:0140467)";"https://www.gsea-msigdb.org/gsea/msigdb/cards/GOBP_INTEGRATED_STRESS_RESPONSE_SIGNALING.html";"The series of molecular signals generated in response to diverse stress stimuli required to restore cellular homeostasis. The core event in this pathway is the phosphorylation of eIF2 alpha by one of four members of the eIF2a kinase family (EIF2AK1/HRI, EIF2AK2/PKR, EIF2AK3/PERK and EIF2AK4/GCN2), which leads to a decrease in global protein synthesis and the induction of selected genes, including the transcription factor ATF4, that together promote cellular recovery. [PMID:27629041]";51;-0,5194746;-0,82126606;0,7605985;1;1;1320;"tags=12%, list=4%, signal=12%"
"TRANSPORT_VESICLE_MEMBRANE (GO:0030658)";"https://www.gsea-msigdb.org/gsea/msigdb/cards/GOCC_TRANSPORT_VESICLE_MEMBRANE.html";"The lipid bilayer surrounding a transport vesicle. [GOC:mah]";253;-0,4087461;-0,8210965;0,9774194;1;1;1283;"tags=6%, list=4%, signal=7%"
"MYELOID_DENDRITIC_CELL_ACTIVATION (GO:0001773)";"https://www.gsea-msigdb.org/gsea/msigdb/cards/GOBP_MYELOID_DENDRITIC_CELL_ACTIVATION.html";"The change in morphology and behavior of a dendritic cell resulting from exposure to a cytokine, chemokine, cellular ligand, or soluble factor. [GOC:mgi_curators, ISBN:0781735149]";32;-0,5488281;-0,8208637;0,7345361;1;1;1320;"tags=19%, list=4%, signal=19%"
"POSITIVE_REGULATION_OF_CELL_CYCLE_CHECKPOINT (GO:1901978)";"https://www.gsea-msigdb.org/gsea/msigdb/cards/GOBP_POSITIVE_REGULATION_OF_CELL_CYCLE_CHECKPOINT.html";"Any process that activates or increases the frequency, rate or extent of cell cycle checkpoint. [GOC:mtg_cell_cycle, GOC:TermGenie, PMID:23028116]";18;-0,58444244;-0,8207051;0,75;1;1;3925;"tags=22%, list=11%, signal=25%"
"REGULATION_OF_PROTEIN_LOCALIZATION_TO_NUCLEUS (GO:1900180)";"https://www.gsea-msigdb.org/gsea/msigdb/cards/GOBP_REGULATION_OF_PROTEIN_LOCALIZATION_TO_NUCLEUS.html";"Any process that modulates the frequency, rate or extent of protein localization to nucleus. [GOC:TermGenie]";148;-0,43127403;-0,8206327;0,8981233;1;1;949;"tags=5%, list=3%, signal=5%"
"REGULATION_OF_MACROPHAGE_ACTIVATION (GO:0043030)";"https://www.gsea-msigdb.org/gsea/msigdb/cards/GOBP_REGULATION_OF_MACROPHAGE_ACTIVATION.html";"Any process that modulates the frequency or rate of macrophage activation. [GOC:jl]";62;-0,49287936;-0,8192294;0,7617801;1;1;616;"tags=6%, list=2%, signal=7%"
"FATTY_ACID_CATABOLIC_PROCESS (GO:0009062)";"https://www.gsea-msigdb.org/gsea/msigdb/cards/GOBP_FATTY_ACID_CATABOLIC_PROCESS.html";"The chemical reactions and pathways resulting in the breakdown of a fatty acid, any of the aliphatic monocarboxylic acids that can be liberated by hydrolysis from naturally occurring fats and oils. Fatty acids are predominantly straight-chain acids of 4 to 24 carbon atoms, which may be saturated or unsaturated; branched fatty acids and hydroxy fatty acids also occur, and very long chain acids of over 30 carbons are found in waxes. [GOC:go_curators]";104;-0,4508304;-0,8190474;0,80779946;1;1;2543;"tags=18%, list=7%, signal=20%"
"DORSAL_SPINAL_CORD_DEVELOPMENT (GO:0021516)";"https://www.gsea-msigdb.org/gsea/msigdb/cards/GOBP_DORSAL_SPINAL_CORD_DEVELOPMENT.html";"The process whose specific outcome is the progression of the dorsal region of the spinal cord over time, from its formation to the mature structure. The dorsal region of the mature spinal cord contains neurons that process and relay sensory input. [GO_REF:0000021, GOC:cls, GOC:dgh, GOC:dph, GOC:jid, PMID:11179871]";21;-0,57480186;-0,8187728;0,72195125;1;1;1411;"tags=19%, list=4%, signal=20%"
"RESPONSE_TO_VITAMIN_A (GO:0033189)";"https://www.gsea-msigdb.org/gsea/msigdb/cards/GOBP_RESPONSE_TO_VITAMIN_A.html";"Any process that results in a change in state or activity of a cell or an organism (in terms of movement, secretion, enzyme production, gene expression, etc.) as a result of a vitamin A stimulus. [GOC:sl]";15;-0,60629636;-0,8185988;0,7369727;1;1;261;"tags=20%, list=1%, signal=20%"
"NADPH_OXIDASE_COMPLEX (GO:0043020)";"https://www.gsea-msigdb.org/gsea/msigdb/cards/GOCC_NADPH_OXIDASE_COMPLEX.html";"A enzyme complex of which the core is a heterodimer composed of a light (alpha) and heavy (beta) chain, and requires the cytosolic regulatory subunits at least NCF1/p47-phox, NCF2/p67-phox, NCF4/p40-phox and the small GTPase RAC1 or RAC2 for activity. Functions in superoxide generation by the NADPH-dependent reduction of O2. [GOC:jl, PMID:11483596, PMID:12440767]";17;-0,6084028;-0,81843096;0,7577197;1;1;95;"tags=6%, list=0%, signal=6%"
"DETECTION_OF_LIGHT_STIMULUS (GO:0009583)";"https://www.gsea-msigdb.org/gsea/msigdb/cards/GOBP_DETECTION_OF_LIGHT_STIMULUS.html";"The series of events in which a light stimulus (in the form of photons) is received and converted into a molecular signal. [GOC:go_curators]";74;-0,47500756;-0,81805676;0,7917738;1;1;1736;"tags=19%, list=5%, signal=20%"
"ANTIGEN_PROCESSING_AND_PRESENTATION_OF_EXOGENOUS_PEPTIDE_ANTIGEN (GO:0002478)";"https://www.gsea-msigdb.org/gsea/msigdb/cards/GOBP_ANTIGEN_PROCESSING_AND_PRESENTATION_OF_EXOGENOUS_PEPTIDE_ANTIGEN.html";"The process in which an antigen-presenting cell expresses a peptide antigen of exogenous origin on its cell surface in association with an MHC protein complex. The peptide is typically a fragment of a larger exogenous protein which has been degraded within the cell. [GOC:add, ISBN:0781735149]";39;-0,5340146;-0,81778264;0,725641;1;1;1019;"tags=8%, list=3%, signal=8%"
"NEUROTROPHIN_TRK_RECEPTOR_SIGNALING_PATHWAY (GO:0048011)";"https://www.gsea-msigdb.org/gsea/msigdb/cards/GOBP_NEUROTROPHIN_TRK_RECEPTOR_SIGNALING_PATHWAY.html";"The series of molecular signals initiated by neurotrophin binding to its receptor on the surface of a target cell where the receptor possesses tyrosine kinase activity, and ending with the regulation of a downstream cellular process, e.g. transcription. [GOC:bf, GOC:ceb, GOC:jc, GOC:signaling, PMID:12065629, Wikipedia:Trk_receptor]";26;-0,56463695;-0,8171901;0,7216981;1;1;53;"tags=4%, list=0%, signal=4%"
"RESPONSE_TO_HYDROGEN_PEROXIDE (GO:0042542)";"https://www.gsea-msigdb.org/gsea/msigdb/cards/GOBP_RESPONSE_TO_HYDROGEN_PEROXIDE.html";"Any process that results in a change in state or activity of a cell or an organism (in terms of movement, secretion, enzyme production, gene expression, etc.) as a result of a hydrogen peroxide (H2O2) stimulus. [GOC:jl]";103;-0,45556334;-0,81661093;0,82767624;1;1;1933;"tags=13%, list=5%, signal=13%"
"RNA_EXPORT_FROM_NUCLEUS (GO:0006405)";"https://www.gsea-msigdb.org/gsea/msigdb/cards/GOBP_RNA_EXPORT_FROM_NUCLEUS.html";"The directed movement of RNA from the nucleus to the cytoplasm. [GOC:ma]";93;-0,45617086;-0,8164383;0,8230769;1;1;6168;"tags=29%, list=17%, signal=35%"
"GLUTAMINE_FAMILY_AMINO_ACID_CATABOLIC_PROCESS (GO:0009065)";"https://www.gsea-msigdb.org/gsea/msigdb/cards/GOBP_GLUTAMINE_FAMILY_AMINO_ACID_CATABOLIC_PROCESS.html";"The chemical reactions and pathways resulting in the breakdown of amino acids of the glutamine family, comprising arginine, glutamate, glutamine and proline. [GOC:ai]";26;-0,5552079;-0,8163015;0,7463054;1;1;2230;"tags=38%, list=6%, signal=41%"
"REGULATION_OF_GLYCOGEN_BIOSYNTHETIC_PROCESS (GO:0005979)";"https://www.gsea-msigdb.org/gsea/msigdb/cards/GOBP_REGULATION_OF_GLYCOGEN_BIOSYNTHETIC_PROCESS.html";"Any process that modulates the frequency, rate or extent of the chemical reactions and pathways resulting in the formation of glycogen. [GOC:go_curators]";32;-0,54647106;-0,816059;0,7427822;1;1;2336;"tags=16%, list=6%, signal=17%"
"THYROID_HORMONE_METABOLIC_PROCESS (GO:0042403)";"https://www.gsea-msigdb.org/gsea/msigdb/cards/GOBP_THYROID_HORMONE_METABOLIC_PROCESS.html";"The chemical reactions and pathways involving any of the compounds secreted by the thyroid gland, largely thyroxine and triiodothyronine. [GOC:jl, ISBN:0198506732]";31;-0,550747;-0,8158841;0,73126614;1;1;428;"tags=13%, list=1%, signal=13%"
"INTERLEUKIN_12_PRODUCTION (GO:0032615)";"https://www.gsea-msigdb.org/gsea/msigdb/cards/GOBP_INTERLEUKIN_12_PRODUCTION.html";"The appearance of interleukin-12 due to biosynthesis or secretion following a cellular stimulus, resulting in an increase in its intracellular or extracellular levels. [GOC:mah]";64;-0,49043533;-0,8158358;0,75641024;1;1;1797;"tags=9%, list=5%, signal=10%"
"NEGATIVE_REGULATION_OF_CELL_KILLING (GO:0031342)";"https://www.gsea-msigdb.org/gsea/msigdb/cards/GOBP_NEGATIVE_REGULATION_OF_CELL_KILLING.html";"Any process that stops, prevents, or reduces the frequency, rate or extent of cell killing. [GOC:mah]";34;-0,5490716;-0,8152774;0,7344913;1;1;637;"tags=6%, list=2%, signal=6%"
"ANTIGEN_PROCESSING_AND_PRESENTATION_OF_ENDOGENOUS_ANTIGEN (GO:0019883)";"https://www.gsea-msigdb.org/gsea/msigdb/cards/GOBP_ANTIGEN_PROCESSING_AND_PRESENTATION_OF_ENDOGENOUS_ANTIGEN.html";"The process in which an antigen-presenting cell expresses antigen (peptide or lipid) of endogenous origin on its cell surface in association with an MHC protein complex. [GOC:add, ISBN:0781735149, PMID:15771591, PMID:15928678]";31;-0,5466485;-0,815018;0,71890545;1;1;313;"tags=10%, list=1%, signal=10%"
"POSITIVE_REGULATION_OF_NEURON_DIFFERENTIATION (GO:0045666)";"https://www.gsea-msigdb.org/gsea/msigdb/cards/GOBP_POSITIVE_REGULATION_OF_NEURON_DIFFERENTIATION.html";"Any process that activates or increases the frequency, rate or extent of neuron differentiation. [GOC:go_curators]";96;-0,45811054;-0,8149625;0,83937824;1;1;1316;"tags=9%, list=4%, signal=10%"
"ORGANOPHOSPHATE_ESTER_TRANSMEMBRANE_TRANSPORTER_ACTIVITY (GO:0015605)";"https://www.gsea-msigdb.org/gsea/msigdb/cards/GOMF_ORGANOPHOSPHATE_ESTER_TRANSMEMBRANE_TRANSPORTER_ACTIVITY.html";"Enables the transfer of organophosphate esters from one side of a membrane to the other. Organophosphate esters are small organic molecules containing phosphate ester bonds. [GOC:mcc]";52;-0,49999517;-0,81489384;0,7564767;1;1;1920;"tags=12%, list=5%, signal=12%"
"PIGMENT_METABOLIC_PROCESS (GO:0042440)";"https://www.gsea-msigdb.org/gsea/msigdb/cards/GOBP_PIGMENT_METABOLIC_PROCESS.html";"The chemical reactions and pathways involving pigment, any general or particular coloring matter in living organisms, e.g. melanin. [GOC:jl, ISBN:0198506732]";80;-0,46956968;-0,8147597;0,78571427;1;1;426;"tags=5%, list=1%, signal=5%"
"TRANSFORMING_GROWTH_FACTOR_BETA_RECEPTOR_BINDING (GO:0005160)";"https://www.gsea-msigdb.org/gsea/msigdb/cards/GOMF_TRANSFORMING_GROWTH_FACTOR_BETA_RECEPTOR_BINDING.html";"Binding to a transforming growth factor beta receptor. [GOC:ai]";26;-0,5619454;-0,81393147;0,7416268;1;1;1491;"tags=19%, list=4%, signal=20%"
"NAD_METABOLIC_PROCESS (GO:0019674)";"https://www.gsea-msigdb.org/gsea/msigdb/cards/GOBP_NAD_METABOLIC_PROCESS.html";"The chemical reactions and pathways involving nicotinamide adenine dinucleotide (NAD+), a coenzyme that interconverts with its reduced form, NADH, in many redox and catabolic reactions. [PMID:28648096]";37;-0,53708047;-0,8130666;0,74278843;1;1;472;"tags=11%, list=1%, signal=11%"
"MITOCHONDRIAL_RNA_METABOLIC_PROCESS (GO:0000959)";"https://www.gsea-msigdb.org/gsea/msigdb/cards/GOBP_MITOCHONDRIAL_RNA_METABOLIC_PROCESS.html";"The chemical reactions and pathways involving RNA transcribed from the mitochondrial genome and occurring in the mitochondrion. [GOC:krc, GOC:mah]";55;-0,49069485;-0,81294143;0,7712082;1;1;6068;"tags=33%, list=17%, signal=39%"
"VESICLE_TETHERING_COMPLEX (GO:0099023)";"https://www.gsea-msigdb.org/gsea/msigdb/cards/GOCC_VESICLE_TETHERING_COMPLEX.html";"Any protein complex that plays a role in vesicle tethering. [GOC:dos, GOC:vw, PMID:27243008]";67;-0,48636928;-0,81291384;0,7766498;1;1;2717;"tags=7%, list=7%, signal=8%"
"KIDNEY_MORPHOGENESIS (GO:0060993)";"https://www.gsea-msigdb.org/gsea/msigdb/cards/GOBP_KIDNEY_MORPHOGENESIS.html";"Morphogenesis of a kidney. A kidney is an organ that filters the blood and excretes the end products of body metabolism in the form of urine. [GOC:dph, GOC:mtg_kidney_jan10]";99;-0,46179724;-0,8127758;0,824;1;1;1085;"tags=12%, list=3%, signal=12%"
"RESPONSE_TO_CALCIUM_ION (GO:0051592)";"https://www.gsea-msigdb.org/gsea/msigdb/cards/GOBP_RESPONSE_TO_CALCIUM_ION.html";"Any process that results in a change in state or activity of a cell or an organism (in terms of movement, secretion, enzyme production, gene expression, etc.) as a result of a calcium ion stimulus. [GOC:ai]";140;-0,4348475;-0,8126776;0,8681319;1;1;943;"tags=7%, list=3%, signal=7%"
"NEGATIVE_REGULATION_OF_SMOOTH_MUSCLE_CELL_PROLIFERATION (GO:0048662)";"https://www.gsea-msigdb.org/gsea/msigdb/cards/GOBP_NEGATIVE_REGULATION_OF_SMOOTH_MUSCLE_CELL_PROLIFERATION.html";"Any process that stops, prevents or reduces the rate or extent of smooth muscle cell proliferation. [CL:0000192, GOC:ebc]";71;-0,4859943;-0,81261045;0,7788945;1;1;1484;"tags=14%, list=4%, signal=15%"
"NEGATIVE_REGULATION_OF_FATTY_ACID_BIOSYNTHETIC_PROCESS (GO:0045717)";"https://www.gsea-msigdb.org/gsea/msigdb/cards/GOBP_NEGATIVE_REGULATION_OF_FATTY_ACID_BIOSYNTHETIC_PROCESS.html";"Any process that stops, prevents, or reduces the frequency, rate or extent of the chemical reactions and pathways resulting in the formation of fatty acids. [GOC:go_curators]";27;-0,54984885;-0,8125411;0,7390244;1;1;462;"tags=7%, list=1%, signal=7%"
"NEGATIVE_REGULATION_OF_LIPOPOLYSACCHARIDE_MEDIATED_SIGNALING_PATHWAY (GO:0031665)";"https://www.gsea-msigdb.org/gsea/msigdb/cards/GOBP_NEGATIVE_REGULATION_OF_LIPOPOLYSACCHARIDE_MEDIATED_SIGNALING_PATHWAY.html";"Any process that stops, prevents, or reduces the frequency, rate or extent of signaling in response to detection of lipopolysaccharide. [GOC:mah]";16;-0,60340726;-0,81244254;0,7665094;1;1;2675;"tags=19%, list=7%, signal=20%"
"S_ADENOSYL_L_METHIONINE_BINDING (GO:1904047)";"https://www.gsea-msigdb.org/gsea/msigdb/cards/GOMF_S_ADENOSYL_L_METHIONINE_BINDING.html";"Binding to S-adenosyl-L-methionine. [GO_REF:0000067, GOC:BHF, GOC:hal, GOC:TermGenie, PMID:22985361]";23;-0,57435125;-0,81234634;0,7488152;1;1;5875;"tags=30%, list=16%, signal=36%"
"NEGATIVE_REGULATION_OF_HUMORAL_IMMUNE_RESPONSE (GO:0002921)";"https://www.gsea-msigdb.org/gsea/msigdb/cards/GOBP_NEGATIVE_REGULATION_OF_HUMORAL_IMMUNE_RESPONSE.html";"Any process that stops, prevents, or reduces the frequency, rate, or extent of a humoral immune response. [GOC:add]";17;-0,5953559;-0,81234056;0,7373272;1;1;395;"tags=18%, list=1%, signal=18%"
