"MEMBRANE_COAT (GO:0030117)";"https://www.gsea-msigdb.org/gsea/msigdb/cards/GOCC_MEMBRANE_COAT.html";"Any of several different proteinaceous coats that can associate with membranes. Membrane coats include those formed by clathrin plus an adaptor complex, the COPI and COPII complexes, and possibly others. They are found associated with membranes on many vesicles as well as other membrane features such as pits and perhaps tubules. [GOC:mah]";96;-0,6525348;-1,1635112;0,18133333;1;1;1105;"tags=4%, list=3%, signal=4%"
"REGULATION_OF_LYMPHOCYTE_MEDIATED_IMMUNITY (GO:0002706)";"https://www.gsea-msigdb.org/gsea/msigdb/cards/GOBP_REGULATION_OF_LYMPHOCYTE_MEDIATED_IMMUNITY.html";"Any process that modulates the frequency, rate, or extent of lymphocyte mediated immunity. [GOC:add]";199;-0,59319025;-1,1630666;0,16430596;1;1;1329;"tags=12%, list=4%, signal=12%"
"QUINONE_BINDING (GO:0048038)";"https://www.gsea-msigdb.org/gsea/msigdb/cards/GOMF_QUINONE_BINDING.html";"Binding to a quinone, any member of a class of diketones derivable from aromatic compounds by conversion of two CH groups into CO groups with any necessary rearrangement of double bonds. [ISBN:0198506732]";17;-0,86013484;-1,1627288;0,30695444;1;1;2704;"tags=24%, list=7%, signal=25%"
"REGULATORY_RNA_BINDING (GO:0061980)";"https://www.gsea-msigdb.org/gsea/msigdb/cards/GOMF_REGULATORY_RNA_BINDING.html";"Binding to a small regulatory RNA, a short RNA (usually 50-200 nt long) that is either independently transcribed or processed from a longer RNA by an RNAse enzyme. [PMID:14622403, PMID:23475961]";56;-0,70140356;-1,1615952;0,24556962;1;1;2085;"tags=9%, list=6%, signal=9%"
"PROTEIN_FOLDING_CHAPERONE_BINDING (GO:0051087)";"https://www.gsea-msigdb.org/gsea/msigdb/cards/GOMF_PROTEIN_FOLDING_CHAPERONE_BINDING.html";"Binding to a chaperone protein, a class of proteins that bind to nascent or unfolded polypeptides and ensure correct folding or transport. [PMID:10585443]";134;-0,6260738;-1,1610452;0,1863517;1;1;1016;"tags=4%, list=3%, signal=5%"
"AROMATIC_AMINO_ACID_METABOLIC_PROCESS (GO:0009072)";"https://www.gsea-msigdb.org/gsea/msigdb/cards/GOBP_AROMATIC_AMINO_ACID_METABOLIC_PROCESS.html";"The chemical reactions and pathways involving aromatic amino acid family, amino acids with aromatic ring (phenylalanine, tyrosine, tryptophan). [GOC:go_curators]";40;-0,74658513;-1,1602185;0,28057554;1;1;1257;"tags=23%, list=3%, signal=23%"
"ORGANIC_ANION_TRANSPORT (GO:0015711)";"https://www.gsea-msigdb.org/gsea/msigdb/cards/GOBP_ORGANIC_ANION_TRANSPORT.html";"The directed movement of organic anions into, out of or within a cell, or between cells, by means of some agent such as a transporter or pore. Organic anions are atoms or small molecules with a negative charge which contain carbon in covalent linkage. [GOC:ai, GOC:krc]";464;-0,54324996;-1,1600444;0,09090909;1;1;1483;"tags=15%, list=4%, signal=16%"
"SPECIFIC_GRANULE_MEMBRANE (GO:0035579)";"https://www.gsea-msigdb.org/gsea/msigdb/cards/GOCC_SPECIFIC_GRANULE_MEMBRANE.html";"The lipid bilayer surrounding a specific granule, a granule with a membranous, tubular internal structure, found primarily in mature neutrophil cells. Most are released into the extracellular fluid. Specific granules contain lactoferrin, lysozyme, vitamin B12 binding protein and elastase. [GOC:bf, PMID:7334549]";90;-0,6471501;-1,1597527;0,17971015;1;1;1542;"tags=13%, list=4%, signal=14%"
"MRNA_CLEAVAGE_FACTOR_COMPLEX (GO:0005849)";"https://www.gsea-msigdb.org/gsea/msigdb/cards/GOCC_MRNA_CLEAVAGE_FACTOR_COMPLEX.html";"Any macromolecular complex involved in cleavage or polyadenylation of mRNA molecules. [GOC:mah, PMID:10357856]";29;-0,79640424;-1,1596005;0,29280397;1;1;623;"tags=3%, list=2%, signal=4%"
"PENTOSYLTRANSFERASE_ACTIVITY (GO:0016763)";"https://www.gsea-msigdb.org/gsea/msigdb/cards/GOMF_PENTOSYLTRANSFERASE_ACTIVITY.html";"Catalysis of the transfer of a pentosyl group from one compound (donor) to another (acceptor). [GOC:jl]";54;-0,7080224;-1,1582818;0,2382134;1;1;1895;"tags=9%, list=5%, signal=10%"
"ATPASE_COUPLED_TRANSMEMBRANE_TRANSPORTER_ACTIVITY (GO:0042626)";"https://www.gsea-msigdb.org/gsea/msigdb/cards/GOMF_ATPASE_COUPLED_TRANSMEMBRANE_TRANSPORTER_ACTIVITY.html";"Primary active transporter of a solute across a membrane, via the reaction: ATP + H2O = ADP + phosphate, to directly drive the transport of a substance across a membrane. The transport protein may be transiently phosphorylated (P-type transporters), or not (ABC-type transporters and other families of transporters). Primary active transport occurs up the solute's concentration gradient and is driven by a primary energy source. [GOC:mtg_transport, ISBN:0815340729]";99;-0,6396393;-1,15746;0,20596206;1;1;1560;"tags=17%, list=4%, signal=18%"
"ATPASE_DEPENDENT_TRANSMEMBRANE_TRANSPORT_COMPLEX (GO:0098533)";"https://www.gsea-msigdb.org/gsea/msigdb/cards/GOCC_ATPASE_DEPENDENT_TRANSMEMBRANE_TRANSPORT_COMPLEX.html";"A transmembrane protein complex that functions in ATPase dependent active transport across a membrane. [GOC:dos]";54;-0,7277146;-1,1573702;0,25365853;1;1;1560;"tags=9%, list=4%, signal=10%"
"POSITIVE_REGULATION_OF_LIPID_LOCALIZATION (GO:1905954)";"https://www.gsea-msigdb.org/gsea/msigdb/cards/GOBP_POSITIVE_REGULATION_OF_LIPID_LOCALIZATION.html";"Any process that activates or increases the frequency, rate or extent of lipid localization. [GO_REF:0000058, GOC:TermGenie, PMID:17564681]";106;-0,6527984;-1,1570754;0,20215634;1;1;774;"tags=12%, list=2%, signal=12%"
"LIPASE_ACTIVATOR_ACTIVITY (GO:0060229)";"https://www.gsea-msigdb.org/gsea/msigdb/cards/GOMF_LIPASE_ACTIVATOR_ACTIVITY.html";"Binds to and increases the activity of a lipase, an enzyme that catalyzes of the hydrolysis of a lipid. [GOC:BHF, GOC:dph, GOC:tb]";23;-0,81952953;-1,1568562;0,3253012;1;1;114;"tags=9%, list=0%, signal=9%"
"NEGATIVE_REGULATION_OF_NEURON_PROJECTION_REGENERATION (GO:0070571)";"https://www.gsea-msigdb.org/gsea/msigdb/cards/GOBP_NEGATIVE_REGULATION_OF_NEURON_PROJECTION_REGENERATION.html";"Any process that stops, prevents, or reduces the frequency, rate or extent of neuron projection regeneration, the regrowth of neuronal processes such as axons or dendrites following their loss or damage. [GOC:mah]";16;-0,858409;-1,1565368;0,3375;1;1;16;"tags=6%, list=0%, signal=6%"
"TRANS_NETWORK_MEMBRANE (GO:0032588)";"https://www.gsea-msigdb.org/gsea/msigdb/cards/GOCC_TRANS_GOLGI_NETWORK_MEMBRANE.html";"The lipid bilayer surrounding any of the compartments that make up the trans-Golgi network. [GOC:mah]";109;-0,6381934;-1,1561121;0,19088319;1;1;2403;"tags=8%, list=7%, signal=9%"
"REGULATION_OF_IMMUNE_EFFECTOR_PROCESS (GO:0002697)";"https://www.gsea-msigdb.org/gsea/msigdb/cards/GOBP_REGULATION_OF_IMMUNE_EFFECTOR_PROCESS.html";"Any process that modulates the frequency, rate, or extent of an immune effector process. [GOC:add]";418;-0,54936725;-1,1554295;0,106529206;1;1;1378;"tags=11%, list=4%, signal=12%"
"NEGATIVE_REGULATION_OF_KINASE_ACTIVITY (GO:0033673)";"https://www.gsea-msigdb.org/gsea/msigdb/cards/GOBP_NEGATIVE_REGULATION_OF_KINASE_ACTIVITY.html";"Any process that stops, prevents, or reduces the frequency, rate or extent of kinase activity, the catalysis of the transfer of a phosphate group, usually from ATP, to a substrate molecule. [GOC:mah]";87;-0,6498554;-1,1550404;0,2039312;1;1;1508;"tags=9%, list=4%, signal=10%"
"POSITIVE_REGULATION_OF_HORMONE_SECRETION (GO:0046887)";"https://www.gsea-msigdb.org/gsea/msigdb/cards/GOBP_POSITIVE_REGULATION_OF_HORMONE_SECRETION.html";"Any process that activates or increases the frequency, rate or extent of the regulated release of a hormone from a cell. [GOC:ai]";154;-0,6087648;-1,1548144;0,19571045;1;1;479;"tags=9%, list=1%, signal=9%"
"NEGATIVE_REGULATION_OF_POST_TRANSCRIPTIONAL_GENE_SILENCING (GO:0060149)";"https://www.gsea-msigdb.org/gsea/msigdb/cards/GOBP_NEGATIVE_REGULATION_OF_POST_TRANSCRIPTIONAL_GENE_SILENCING.html";"Any process that decreases the frequency, rate or extent of the inactivation of gene expression by a posttranscriptional mechanism. [GOC:dph]";19;-0,8453143;-1,1547723;0,33251834;1;1;840;"tags=16%, list=2%, signal=16%"
"REGULATION_OF_CD8_POSITIVE_ALPHA_BETA_T_CELL_ACTIVATION (GO:2001185)";"https://www.gsea-msigdb.org/gsea/msigdb/cards/GOBP_REGULATION_OF_CD8_POSITIVE_ALPHA_BETA_T_CELL_ACTIVATION.html";"Any process that modulates the frequency, rate or extent of CD8-positive, alpha-beta T cell activation. [GOC:obol]";20;-0,82671136;-1,1543992;0,30900243;1;1;313;"tags=10%, list=1%, signal=10%"
"CLATHRIN_COAT (GO:0030118)";"https://www.gsea-msigdb.org/gsea/msigdb/cards/GOCC_CLATHRIN_COAT.html";"A membrane coat found on coated pits and some coated vesicles; consists of polymerized clathrin triskelions, each comprising three clathrin heavy chains and three clathrin light chains, linked to the membrane via one of the AP adaptor complexes. [GOC:mah, PMID:11252894, PMID:9531549]";51;-0,7087828;-1,154392;0,29100528;1;1;1105;"tags=8%, list=3%, signal=8%"
"CLATHRIN_VESICLE_COAT (GO:0030125)";"https://www.gsea-msigdb.org/gsea/msigdb/cards/GOCC_CLATHRIN_VESICLE_COAT.html";"A clathrin coat found on a vesicle. [GOC:mah]";36;-0,7647309;-1,1539738;0,27970296;1;1;1105;"tags=8%, list=3%, signal=9%"
"OXIDOREDUCTASE_ACTIVITY_ACTING_ON_PAIRED_DONORS_WITH_INCORPORATION_OR_REDUCTION_OF_MOLECULAR_OXYGEN_REDUCED_FLAVIN_OR_FLAVOPROTEIN_AS_ONE_DONOR_AND_INCORPORATION_OF_ONE_ATOM_OF_OXYGEN (GO:0016712)";"https://www.gsea-msigdb.org/gsea/msigdb/cards/GOMF_OXIDOREDUCTASE_ACTIVITY_ACTING_ON_PAIRED_DONORS_WITH_INCORPORATION_OR_REDUCTION_OF_MOLECULAR_OXYGEN_REDUCED_FLAVIN_OR_FLAVOPROTEIN_AS_ONE_DONOR_AND_INCORPORATION_OF_ONE_ATOM_OF_OXYGEN.html";"Catalysis of an oxidation-reduction (redox) reaction in which hydrogen or electrons are transferred from reduced flavin or flavoprotein and one other donor, and one atom of oxygen is incorporated into one donor. [EC:1.14.14.-]";45;-0,72666466;-1,1539631;0,2825;1;1;1745;"tags=31%, list=5%, signal=33%"
"VACUOLAR_ACIDIFICATION (GO:0007035)";"https://www.gsea-msigdb.org/gsea/msigdb/cards/GOBP_VACUOLAR_ACIDIFICATION.html";"Any process that reduces the pH of the vacuole, measured by the concentration of the hydrogen ion. [GOC:jid]";36;-0,77101356;-1,1538148;0,28398058;1;1;2250;"tags=8%, list=6%, signal=9%"
"REGULATION_OF_HUMORAL_IMMUNE_RESPONSE (GO:0002920)";"https://www.gsea-msigdb.org/gsea/msigdb/cards/GOBP_REGULATION_OF_HUMORAL_IMMUNE_RESPONSE.html";"Any process that modulates the frequency, rate, or extent of a humoral immune response. [GOC:add]";48;-0,7159536;-1,1537769;0,26546392;1;1;598;"tags=15%, list=2%, signal=15%"
"NEGATIVE_REGULATION_OF_CELL_ACTIVATION (GO:0050866)";"https://www.gsea-msigdb.org/gsea/msigdb/cards/GOBP_NEGATIVE_REGULATION_OF_CELL_ACTIVATION.html";"Any process that stops, prevents, or reduces the frequency, rate or extent of cell activation. [GOC:ai]";229;-0,57909393;-1,15377;0,1661891;1;1;997;"tags=10%, list=3%, signal=11%"
"REGULATION_OF_FIBRINOLYSIS (GO:0051917)";"https://www.gsea-msigdb.org/gsea/msigdb/cards/GOBP_REGULATION_OF_FIBRINOLYSIS.html";"Any process that modulates the frequency, rate or extent of fibrinolysis, an ongoing process that solubilizes fibrin, resulting in the removal of small blood clots. [GOC:ai]";17;-0,8584448;-1,153696;0,3225058;1;1;307;"tags=29%, list=1%, signal=30%"
"REGULATION_OF_STEROL_TRANSPORT (GO:0032371)";"https://www.gsea-msigdb.org/gsea/msigdb/cards/GOBP_REGULATION_OF_STEROL_TRANSPORT.html";"Any process that modulates the frequency, rate or extent of the directed movement of sterols into, out of or within a cell, or between cells, by means of some agent such as a transporter or pore. [GOC:mah]";79;-0,6616957;-1,1535213;0,2506964;1;1;1544;"tags=16%, list=4%, signal=17%"
"COMPLEMENT_ACTIVATION_ALTERNATIVE_PATHWAY (GO:0006957)";"https://www.gsea-msigdb.org/gsea/msigdb/cards/GOBP_COMPLEMENT_ACTIVATION_ALTERNATIVE_PATHWAY.html";"Any process involved in the activation of any of the steps of the alternative pathway of the complement cascade which allows for the direct killing of microbes and the regulation of other immune processes. [GOC:add, ISBN:0781735149]";18;-0,83676624;-1,1535088;0,33568075;1;1;490;"tags=22%, list=1%, signal=23%"
"REGULATION_OF_RESPONSE_TO_TUMOR_CELL (GO:0002834)";"https://www.gsea-msigdb.org/gsea/msigdb/cards/GOBP_REGULATION_OF_RESPONSE_TO_TUMOR_CELL.html";"Any process that modulates the frequency, rate, or extent of a response to tumor cell. [GOC:add]";29;-0,78562564;-1,153449;0,28817734;1;1;1329;"tags=7%, list=4%, signal=7%"
"MYOSIN_FILAMENT (GO:0032982)";"https://www.gsea-msigdb.org/gsea/msigdb/cards/GOCC_MYOSIN_FILAMENT.html";"A supramolecular fiber containing myosin heavy chains, plus associated light chains and other proteins, in which the myosin heavy chains are arranged into a filament. [GOC:mah]";24;-0,79751253;-1,1531619;0,31496063;1;1;1727;"tags=21%, list=5%, signal=22%"
"PROTEASOME_CORE_COMPLEX (GO:0005839)";"https://www.gsea-msigdb.org/gsea/msigdb/cards/GOCC_PROTEASOME_CORE_COMPLEX.html";"A multisubunit barrel shaped endoprotease complex, which is the core of the proteasome complex. [GOC:rb, PMID:10806206]";20;-0,8235979;-1,1527083;0,31828442;1;1;5242;"tags=35%, list=14%, signal=41%"
"POSITIVE_REGULATION_OF_PROTEASOMAL_UBIQUITIN_DEPENDENT_PROTEIN_CATABOLIC_PROCESS (GO:0032436)";"https://www.gsea-msigdb.org/gsea/msigdb/cards/GOBP_POSITIVE_REGULATION_OF_PROTEASOMAL_UBIQUITIN_DEPENDENT_PROTEIN_CATABOLIC_PROCESS.html";"Any process that activates or increases the frequency, rate or extent of the breakdown of a protein or peptide by hydrolysis of its peptide bonds, initiated by the covalent attachment of ubiquitin, and mediated by the proteasome. [GOC:mah]";82;-0,67244756;-1,1526253;0,2751196;1;1;1554;"tags=11%, list=4%, signal=11%"
"NUCLEOSIDE_DIPHOSPHATE_PHOSPHATASE_ACTIVITY (GO:0017110)";"https://www.gsea-msigdb.org/gsea/msigdb/cards/GOMF_NUCLEOSIDE_DIPHOSPHATE_PHOSPHATASE_ACTIVITY.html";"Catalysis of the reaction: a nucleoside diphosphate + H2O = a nucleoside monophosphate + phosphate. [EC:3.6.1.6]";17;-0,83715343;-1,151186;0,3482143;1;1;3328;"tags=18%, list=9%, signal=19%"
"PROTEIN_LOCALIZATION_TO_SITE_OF_DOUBLE_STRAND_BREAK (GO:1990166)";"https://www.gsea-msigdb.org/gsea/msigdb/cards/GOBP_PROTEIN_LOCALIZATION_TO_SITE_OF_DOUBLE_STRAND_BREAK.html";"Any process in which a protein is transported to, or maintained at, a region of a chromosome at which a DNA double-strand break has occurred. [GOC:mah, PMID:23080121]";16;-0,8670702;-1,1509764;0,29567307;1;1;835;"tags=6%, list=2%, signal=6%"
"POSITIVE_REGULATION_OF_MYELOID_CELL_DIFFERENTIATION (GO:0045639)";"https://www.gsea-msigdb.org/gsea/msigdb/cards/GOBP_POSITIVE_REGULATION_OF_MYELOID_CELL_DIFFERENTIATION.html";"Any process that activates or increases the frequency, rate or extent of myeloid cell differentiation. [GOC:go_curators]";111;-0,62919945;-1,1508287;0,2;1;1;1316;"tags=14%, list=4%, signal=15%"
"INTERLEUKIN_1_PRODUCTION (GO:0032612)";"https://www.gsea-msigdb.org/gsea/msigdb/cards/GOBP_INTERLEUKIN_1_PRODUCTION.html";"The appearance of interleukin-1 due to biosynthesis or secretion following a cellular stimulus, resulting in an increase in its intracellular or extracellular levels. [GOC:mah]";132;-0,6173008;-1,1508013;0,2201087;1;1;948;"tags=11%, list=3%, signal=11%"
"CCR_CHEMOKINE_RECEPTOR_BINDING (GO:0048020)";"https://www.gsea-msigdb.org/gsea/msigdb/cards/GOMF_CCR_CHEMOKINE_RECEPTOR_BINDING.html";"Binding to a CCR chemokine receptor. [GOC:ai]";50;-0,7210659;-1,1506379;0,2825;1;1;1149;"tags=16%, list=3%, signal=16%"
"FLAVIN_ADENINE_DINUCLEOTIDE_BINDING (GO:0050660)";"https://www.gsea-msigdb.org/gsea/msigdb/cards/GOMF_FLAVIN_ADENINE_DINUCLEOTIDE_BINDING.html";"Binding to FAD, flavin-adenine dinucleotide, the coenzyme or the prosthetic group of various flavoprotein oxidoreductase enzymes, in either the oxidized form, FAD, or the reduced form, FADH2. [GOC:ai, GOC:imk, ISBN:0198506732]";85;-0,6495764;-1,150318;0,19843341;1;1;1875;"tags=18%, list=5%, signal=19%"
"KINESIN_BINDING (GO:0019894)";"https://www.gsea-msigdb.org/gsea/msigdb/cards/GOMF_KINESIN_BINDING.html";"Interacting selectively and non-covalently and stoichiometrically with kinesin, a member of a superfamily of microtubule-based motor proteins that perform force-generating tasks such as organelle transport and chromosome segregation. [GOC:curators, PMID:8606779]";44;-0,7334765;-1,1491088;0,2777778;1;1;430;"tags=7%, list=1%, signal=7%"
"NEGATIVE_REGULATION_OF_IMMUNE_RESPONSE (GO:0050777)";"https://www.gsea-msigdb.org/gsea/msigdb/cards/GOBP_NEGATIVE_REGULATION_OF_IMMUNE_RESPONSE.html";"Any process that stops, prevents, or reduces the frequency, rate or extent of the immune response, the immunological reaction of an organism to an immunogenic stimulus. [GOC:ai]";215;-0,5798047;-1,1484532;0,14409222;1;1;1054;"tags=7%, list=3%, signal=8%"
"CUL5_RING_UBIQUITIN_LIGASE_COMPLEX (GO:0031466)";"https://www.gsea-msigdb.org/gsea/msigdb/cards/GOCC_CUL5_RING_UBIQUITIN_LIGASE_COMPLEX.html";"A ubiquitin ligase complex in which a cullin from the Cul5 subfamily and a RING domain protein form the catalytic core; substrate specificity is conferred by an elongin-BC adaptor and a SOCS/BC box protein. [PMID:15571813, PMID:15688063]";15;-0,85099036;-1,1483896;0,33090025;1;1;172;"tags=7%, list=0%, signal=7%"
"MODIFIED_AMINO_ACID_CATABOLIC_PROCESS (GO:0042219)";"https://www.gsea-msigdb.org/gsea/msigdb/cards/GOBP_MODIFIED_AMINO_ACID_CATABOLIC_PROCESS.html";"The chemical reactions and pathways resulting in the breakdown of compounds derived from amino acids, organic acids containing one or more amino substituents. [GOC:ai]";34;-0,75054204;-1,1480063;0,30024213;1;1;904;"tags=29%, list=2%, signal=30%"
"I_SMAD_BINDING (GO:0070411)";"https://www.gsea-msigdb.org/gsea/msigdb/cards/GOMF_I_SMAD_BINDING.html";"Binding to an inhibitory SMAD signaling protein. [GOC:BHF, GOC:vk, PMID:19114992]";16;-0,84418;-1,1478469;0,34398034;1;1;1819;"tags=19%, list=5%, signal=20%"
"SOLUTE_MONOATOMIC_CATION_SYMPORTER_ACTIVITY (GO:0015294)";"https://www.gsea-msigdb.org/gsea/msigdb/cards/GOMF_SOLUTE_MONOATOMIC_CATION_SYMPORTER_ACTIVITY.html";"Enables the transfer of a solute or solutes from one side of a membrane to the other according to the reaction: solute(out) + cation(out) = solute(in) + cation(in). [GOC:ai]";117;-0,6247067;-1,1477817;0,21387284;1;1;1719;"tags=18%, list=5%, signal=19%"
"DENDRITIC_SPINE_MEMBRANE (GO:0032591)";"https://www.gsea-msigdb.org/gsea/msigdb/cards/GOCC_DENDRITIC_SPINE_MEMBRANE.html";"The portion of the plasma membrane surrounding a dendritic spine. [GOC:mah]";16;-0,82873636;-1,1476798;0,34878048;1;1;354;"tags=6%, list=1%, signal=6%"
"INTERLEUKIN_1_BETA_PRODUCTION (GO:0032611)";"https://www.gsea-msigdb.org/gsea/msigdb/cards/GOBP_INTERLEUKIN_1_BETA_PRODUCTION.html";"The appearance of interleukin-1 beta due to biosynthesis or secretion following a cellular stimulus, resulting in an increase in its intracellular or extracellular levels. [GOC:mah]";112;-0,629477;-1,1476513;0,20612814;1;1;948;"tags=11%, list=3%, signal=11%"
"REGULATION_OF_SUBSTRATE_ADHESION_DEPENDENT_CELL_SPREADING (GO:1900024)";"https://www.gsea-msigdb.org/gsea/msigdb/cards/GOBP_REGULATION_OF_SUBSTRATE_ADHESION_DEPENDENT_CELL_SPREADING.html";"Any process that modulates the frequency, rate or extent of substrate adhesion-dependent cell spreading. [GOC:TermGenie, GOC:yaf]";61;-0,6984943;-1,1471545;0,27139366;1;1;962;"tags=11%, list=3%, signal=12%"
"MANNOSIDASE_ACTIVITY (GO:0015923)";"https://www.gsea-msigdb.org/gsea/msigdb/cards/GOMF_MANNOSIDASE_ACTIVITY.html";"Catalysis of the hydrolysis of mannosyl compounds, substances containing a group derived from a cyclic form of mannose or a mannose derivative. [GOC:ai]";15;-0,8433824;-1,1468569;0,3449074;1;1;2407;"tags=13%, list=7%, signal=14%"
"DICARBOXYLIC_ACID_CATABOLIC_PROCESS (GO:0043649)";"https://www.gsea-msigdb.org/gsea/msigdb/cards/GOBP_DICARBOXYLIC_ACID_CATABOLIC_PROCESS.html";"The chemical reactions and pathways resulting in the breakdown of dicarboxylic acids, any organic acid containing two carboxyl (-COOH) groups. [ISBN:0198506732]";18;-0,8231849;-1,1468495;0,34673366;1;1;1606;"tags=28%, list=4%, signal=29%"
"COENZYME_A_METABOLIC_PROCESS (GO:0015936)";"https://www.gsea-msigdb.org/gsea/msigdb/cards/GOBP_COENZYME_A_METABOLIC_PROCESS.html";"The chemical reactions and pathways involving coenzyme A, 3'-phosphoadenosine-(5')diphospho(4')pantatheine, an acyl carrier in many acylation and acyl-transfer reactions in which the intermediate is a thiol ester. [ISBN:0198547684]";18;-0,836212;-1,1464733;0,3487298;1;1;2396;"tags=28%, list=7%, signal=30%"
"HOMOTYPIC_CELL_CELL_ADHESION (GO:0034109)";"https://www.gsea-msigdb.org/gsea/msigdb/cards/GOBP_HOMOTYPIC_CELL_CELL_ADHESION.html";"The attachment of a cell to a second cell of the identical type via adhesion molecules. [GOC:add]";105;-0,64317787;-1,1462297;0,21808511;1;1;883;"tags=10%, list=2%, signal=11%"
"RESPONSE_TO_MUSCLE_ACTIVITY (GO:0014850)";"https://www.gsea-msigdb.org/gsea/msigdb/cards/GOBP_RESPONSE_TO_MUSCLE_ACTIVITY.html";"Any process that results in a change in state or activity of a cell or an organism (in terms of movement, secretion, enzyme production, gene expression, etc.) as a result of a muscle activity stimulus. [GOC:mtg_muscle]";33;-0,75428855;-1,1452755;0,30827066;1;1;630;"tags=15%, list=2%, signal=15%"
"ICOSANOID_METABOLIC_PROCESS (GO:0006690)";"https://www.gsea-msigdb.org/gsea/msigdb/cards/GOBP_ICOSANOID_METABOLIC_PROCESS.html";"The chemical reactions and pathways involving icosanoids, any of a group of C20 polyunsaturated fatty acids. [GOC:ma]";123;-0,6239301;-1,1447871;0,19506173;1;1;1560;"tags=20%, list=4%, signal=20%"
"FUCOSYLATION (GO:0036065)";"https://www.gsea-msigdb.org/gsea/msigdb/cards/GOBP_FUCOSYLATION.html";"The covalent attachment of a fucosyl group to an acceptor molecule. [GOC:sart, PMID:19948734]";16;-0,83475167;-1,1445013;0,33183858;1;1;1711;"tags=19%, list=5%, signal=20%"
"STORE_OPERATED_CALCIUM_ENTRY (GO:0002115)";"https://www.gsea-msigdb.org/gsea/msigdb/cards/GOBP_STORE_OPERATED_CALCIUM_ENTRY.html";"A calcium ion entry mechanism in the plasma membrane activated by the depletion of calcium ion from the internal calcium ion store in the endoplasmic reticulum. [GOC:hjd, PMID:11120592, PMID:17956991]";24;-0,79113567;-1,1440822;0,31782946;1;1;988;"tags=13%, list=3%, signal=13%"
"MUSCLE_CELL_APOPTOTIC_PROCESS (GO:0010657)";"https://www.gsea-msigdb.org/gsea/msigdb/cards/GOBP_MUSCLE_CELL_APOPTOTIC_PROCESS.html";"A form of programmed cell death induced by external or internal signals that trigger the activity of proteolytic caspases, whose actions dismantle a muscle cell and result in its death. A muscle cell is a mature contractile cell, commonly known as a myocyte, that forms one of three kinds of muscle. [CL:0000187, GOC:dph, GOC:mtg_apoptosis, GOC:tb]";101;-0,63280636;-1,1439745;0,18579236;1;1;1284;"tags=5%, list=4%, signal=5%"
"COMPACT_MYELIN (GO:0043218)";"https://www.gsea-msigdb.org/gsea/msigdb/cards/GOCC_COMPACT_MYELIN.html";"The portion of the myelin sheath in which layers of cell membrane are tightly juxtaposed, completely excluding cytoplasm. The juxtaposed cytoplasmic surfaces form the major dense line, while the juxtaposed extracellular surfaces form the interperiod line visible in electron micrographs. [GOC:dgh, NIF_Subcellular:sao1123256993]";15;-0,85155255;-1,1437312;0,3263158;1;1;357;"tags=20%, list=1%, signal=20%"
"DNA_TEMPLATED_TRANSCRIPTION_TERMINATION (GO:0006353)";"https://www.gsea-msigdb.org/gsea/msigdb/cards/GOBP_DNA_TEMPLATED_TRANSCRIPTION_TERMINATION.html";"The completion of transcription: the RNA polymerase pauses, the RNA-DNA hybrid dissociates, followed by the release of the RNA polymerase from its DNA template. [GOC:txnOH, PMID:15020047, PMID:18280161, PMID:30978344]";30;-0,7735544;-1,1432277;0,30104712;1;1;5250;"tags=23%, list=14%, signal=27%"
"REGULATION_OF_RENAL_SYSTEM_PROCESS (GO:0098801)";"https://www.gsea-msigdb.org/gsea/msigdb/cards/GOBP_REGULATION_OF_RENAL_SYSTEM_PROCESS.html";"Any process that modulates the frequency, rate or extent of a system process, a multicellular organismal process carried out by the renal system. [GOC:dos]";24;-0,8059097;-1,1427817;0,32107842;1;1;1715;"tags=29%, list=5%, signal=31%"
"ASYMMETRIC_CELL_DIVISION (GO:0008356)";"https://www.gsea-msigdb.org/gsea/msigdb/cards/GOBP_ASYMMETRIC_CELL_DIVISION.html";"The asymmetric division of cells to produce two daughter cells with different developmental potentials. It is of fundamental significance for the generation of cell diversity. [PMID:11672519]";19;-0,81856364;-1,1426507;0,3356974;1;1;1322;"tags=16%, list=4%, signal=16%"
"POTASSIUM_ION_EXPORT_ACROSS_PLASMA_MEMBRANE (GO:0097623)";"https://www.gsea-msigdb.org/gsea/msigdb/cards/GOBP_POTASSIUM_ION_EXPORT_ACROSS_PLASMA_MEMBRANE.html";"The directed movement of potassium ions from inside of a cell, across the plasma membrane and into the extracellular region. [GOC:vw, PMID:11932440]";24;-0,79413104;-1,1426299;0,33333334;1;1;937;"tags=21%, list=3%, signal=21%"
"REGULATION_OF_DEFENSE_RESPONSE_TO_BACTERIUM (GO:1900424)";"https://www.gsea-msigdb.org/gsea/msigdb/cards/GOBP_REGULATION_OF_DEFENSE_RESPONSE_TO_BACTERIUM.html";"Any process that modulates the frequency, rate or extent of defense response to bacterium. [GOC:TermGenie, PMID:22346749]";19;-0,8165143;-1,1419896;0,34673366;1;1;509;"tags=16%, list=1%, signal=16%"
"OXIDATIVE_PHOSPHORYLATION (GO:0006119)";"https://www.gsea-msigdb.org/gsea/msigdb/cards/GOBP_OXIDATIVE_PHOSPHORYLATION.html";"The phosphorylation of ADP to ATP that accompanies the oxidation of a metabolite through the operation of the respiratory chain. Oxidation of compounds establishes a proton gradient across the membrane, providing the energy for ATP synthesis. [ISBN:0198506732, ISBN:0471331309]";147;-0,61243695;-1,1418967;0,19008264;1;1;3327;"tags=16%, list=9%, signal=17%"
